{
  "schema_version": 2,
  "tenant_id": "example-tenant",
  "agent_id": "example-agent",
  "model": {
    "adapter": "demo"
  },
  "limits": {
    "max_steps": 8,
    "max_output_tokens": 1024,
    "token_budget": 100000,
    "timeout_seconds": 60,
    "max_context_bytes": 60000,
    "max_tool_result_bytes": 24000
  }
}
